{
  "handoff_key": "daily:2026-07-29",
  "project_id": "jyotish-baje",
  "owner": "Utsav",
  "status": "complete",
  "created_at": "2026-07-29T09:52:39+05:45",
  "completed_at": "2026-07-29T09:52:39+05:45",
  "artifacts": [
    "reports/daily/2026-07-29.json",
    "coordination/notifications/2026-07-29/jyotish-baje-daily-posting-2026-07-29-proof.json"
  ],
  "proof": [
    "proof/2026-07-29/README.md",
    "proof/2026-07-29/instagram-carousel-readback.md",
    "proof/2026-07-29/instagram-posted.jpg",
    "proof/2026-07-29/tiktok-posted.jpg"
  ],
  "notification": {
    "channel": "github_issue",
    "handoff_key": "daily:2026-07-29",
    "issue_reference": "https://github.com/Sirish24/sirish-utsav-collaboration/issues/26",
    "attempted": true,
    "assignment_status": "assigned",
    "notes": "Posting proof and the completion readback are attached to the July 29 daily handoff; the source package remains on the feature branch at 8b9037e and is not claimed merged into main."
  },
  "blockers": [],
  "deviations": [
    "The screenshots are user-supplied device evidence; this workspace did not sign in to or publish on either platform.",
    "Direct Instagram and TikTok post URLs are not visible, so no direct post URL is claimed.",
    "The source package remains on origin/agent/jyotish-carousel-rashi-watermarks at 8b9037e; this handoff does not claim a merge into main."
  ]
}
