{
  "handoff_key": "daily:2026-07-30",
  "project_id": "jyotish-baje",
  "owner": "Utsav",
  "status": "complete",
  "created_at": "2026-07-30T00:15:10+05:45",
  "completed_at": "2026-07-30T00:15:10+05:45",
  "artifacts": [
    "reports/daily/2026-07-30.json",
    "coordination/notifications/2026-07-30/jyotish-baje-daily-posting-2026-07-30-proof.json"
  ],
  "proof": [
    "proof/2026-07-30/README.md",
    "proof/2026-07-30/instagram-carousel-readback.md",
    "proof/2026-07-30/instagram-posted.png",
    "proof/2026-07-30/tiktok-posted.png"
  ],
  "notification": {
    "channel": "github_issue",
    "handoff_key": "daily:2026-07-30",
    "issue_reference": "https://github.com/Sirish24/sirish-utsav-collaboration/issues/28",
    "attempted": true,
    "assignment_status": "assigned",
    "notes": "Posting proof and the completion readback are attached to Issue #28. The source package remains on the feature branch at da179dffb8d574691f457994faabb6c1ac239337 and is not claimed merged into main."
  },
  "blockers": [],
  "deviations": [
    "The screenshots are user-supplied evidence; this workspace did not sign in to or publish on either platform.",
    "Direct Instagram and TikTok post URLs are not visible, so no direct post URL is claimed.",
    "Instagram visibly confirms 1/14. TikTok visibly confirms a live multi-photo post, but its exact slide count and order are not printed in the supplied screenshot.",
    "The source package remains on origin/agent/jyotish-carousel-rashi-watermarks at da179dffb8d574691f457994faabb6c1ac239337; this handoff does not claim a merge into main."
  ]
}
